{
  "audit_log_slice": [
    {
      "actor": "strategy-author",
      "created_at": "2026-06-24T09:35:45Z",
      "entry_hash": "sha256:a117d21f3d5632ffc52c8632b4fcd0678dd06a92616fda0840c7e1311fb3ab5c",
      "event_type": "strategy_version_created",
      "payload": {
        "actor_auth": {
          "actor": "service-token",
          "actor_display_name": null,
          "actor_role": "admin",
          "actor_scopes": [
            "admin",
            "execute-demo",
            "read-only",
            "release-write"
          ],
          "auth_method": "service_token",
          "auth_subject": "service-token",
          "principal_id": "service-token"
        },
        "package_hash": "sha256:f0d62f9eba4325984d32f45d1b2ad03227127275aebb53bcb6a7f2dabd120ca6",
        "strategy_id": "release-demo-strategy",
        "version_id": "release-demo-v1"
      },
      "previous_entry_hash": "sha256:genesis",
      "release_id": "release-demo-good",
      "schema_version": "redline.release.audit.v1"
    },
    {
      "actor": "strategy-author",
      "created_at": "2026-06-24T09:35:45Z",
      "entry_hash": "sha256:9faf12a4606e7678d8a785c9d17a56742afcd0b1f258c2336c716a8e7ea12599",
      "event_type": "release_candidate_created",
      "payload": {
        "actor_auth": {
          "actor": "service-token",
          "actor_display_name": null,
          "actor_role": "admin",
          "actor_scopes": [
            "admin",
            "execute-demo",
            "read-only",
            "release-write"
          ],
          "auth_method": "service_token",
          "auth_subject": "service-token",
          "principal_id": "service-token"
        },
        "state": "draft"
      },
      "previous_entry_hash": "sha256:a117d21f3d5632ffc52c8632b4fcd0678dd06a92616fda0840c7e1311fb3ab5c",
      "release_id": "release-demo-good",
      "schema_version": "redline.release.audit.v1"
    },
    {
      "actor": "service-token",
      "created_at": "2026-06-24T09:35:45Z",
      "entry_hash": "sha256:40155c64e0bc414bb8ba077bfa06243bb7911c39d9cd80c70fadefa6d1add3f6",
      "event_type": "redline_run_bound",
      "payload": {
        "reason_code": "PASS",
        "run_id": "run_1094a295995fc4cdc7dde24b",
        "run_state": "pass"
      },
      "previous_entry_hash": "sha256:9faf12a4606e7678d8a785c9d17a56742afcd0b1f258c2336c716a8e7ea12599",
      "release_id": "release-demo-good",
      "schema_version": "redline.release.audit.v1"
    },
    {
      "actor": "service-token",
      "created_at": "2026-06-24T09:35:45Z",
      "entry_hash": "sha256:f027338246ade290eba1a12749cc1a7e29494d9a996eb6972049816d74801a5d",
      "event_type": "redline_verified",
      "payload": {
        "receipt_hash": "sha256:071b36293c3667779cfdf46e0840f796314fdc8d7a8b980bce0d3851762042f2",
        "report_hash": "sha256:2a21b02a5c7f5374cabaf75c9055277e4722d65642563b246a0bed41b70beeaa"
      },
      "previous_entry_hash": "sha256:40155c64e0bc414bb8ba077bfa06243bb7911c39d9cd80c70fadefa6d1add3f6",
      "release_id": "release-demo-good",
      "schema_version": "redline.release.audit.v1"
    },
    {
      "actor": "service-token",
      "created_at": "2026-06-24T09:35:45Z",
      "entry_hash": "sha256:4a6847d74564751f24c199e1bc4b23f6dbcb583034d220f2998df5ee755ac195",
      "event_type": "simulation_evidence_imported",
      "payload": {
        "evidence_hash": "sha256:0436cb6897f238ebde1058ac39ee03cc6cf3ebf8a9b4f463a26c6f22006e00d9",
        "source": "local_backtest",
        "symbol": "BTCUSDT"
      },
      "previous_entry_hash": "sha256:f027338246ade290eba1a12749cc1a7e29494d9a996eb6972049816d74801a5d",
      "release_id": "release-demo-good",
      "schema_version": "redline.release.audit.v1"
    },
    {
      "actor": "service-token",
      "created_at": "2026-06-24T09:35:45Z",
      "entry_hash": "sha256:460d9baa416baade6369a86d10900a713f909aa81da0ec83c355dfe2e1719a5b",
      "event_type": "risk_policy_bound",
      "payload": {
        "risk_policy_hash": "sha256:be4e21b5549f1b49b90c90f3f2ceace547192bdd16b2f4ee0feb81a4c78bff96"
      },
      "previous_entry_hash": "sha256:4a6847d74564751f24c199e1bc4b23f6dbcb583034d220f2998df5ee755ac195",
      "release_id": "release-demo-good",
      "schema_version": "redline.release.audit.v1"
    },
    {
      "actor": "service-token",
      "created_at": "2026-06-24T09:35:45Z",
      "entry_hash": "sha256:5adfbfd8784293786692cd6f6e1132e7641356ff6a2f51a4625b6ac65e90271e",
      "event_type": "risk_policy_checked",
      "payload": {
        "breach": null,
        "ok": true,
        "risk_policy_decision": {
          "decision": "allow"
        }
      },
      "previous_entry_hash": "sha256:460d9baa416baade6369a86d10900a713f909aa81da0ec83c355dfe2e1719a5b",
      "release_id": "release-demo-good",
      "schema_version": "redline.release.audit.v1"
    },
    {
      "actor": "service-token",
      "created_at": "2026-06-24T09:35:45Z",
      "entry_hash": "sha256:dae28c0096551072c435ee430a96276280c56b1a46f3669f1931a193e7d187a4",
      "event_type": "approval_granted",
      "payload": {
        "actor_auth": {
          "actor": "service-token",
          "actor_display_name": null,
          "actor_role": "admin",
          "actor_scopes": [
            "admin",
            "execute-demo",
            "read-only",
            "release-write"
          ],
          "auth_method": "service_token",
          "auth_subject": "service-token",
          "principal_id": "service-token"
        },
        "evidence_manifest_hash": "sha256:1679b028d99273e070021daa1ec454b2bff9c6ac878c146af778dcbfe7720444",
        "identity_lock_hash": "sha256:f11c2d123ce6f90e41532cda93e3e7c46cf7850238b193c1d03676e646a90514",
        "package_hash": "sha256:f0d62f9eba4325984d32f45d1b2ad03227127275aebb53bcb6a7f2dabd120ca6",
        "risk_policy_hash": "sha256:be4e21b5549f1b49b90c90f3f2ceace547192bdd16b2f4ee0feb81a4c78bff96"
      },
      "previous_entry_hash": "sha256:5adfbfd8784293786692cd6f6e1132e7641356ff6a2f51a4625b6ac65e90271e",
      "release_id": "release-demo-good",
      "schema_version": "redline.release.audit.v1"
    },
    {
      "actor": "service-token",
      "created_at": "2026-06-24T09:35:45Z",
      "entry_hash": "sha256:fa1fcc2b3fe64192c755d3d7bd474244aa9397ee6bfb6b43a50eaaae27bcc3bc",
      "event_type": "demo_order_requested",
      "payload": {
        "risk_policy_decision": {
          "decision": "allow"
        },
        "run_id": "run_1094a295995fc4cdc7dde24b"
      },
      "previous_entry_hash": "sha256:dae28c0096551072c435ee430a96276280c56b1a46f3669f1931a193e7d187a4",
      "release_id": "release-demo-good",
      "schema_version": "redline.release.audit.v1"
    },
    {
      "actor": "service-token",
      "created_at": "2026-06-24T09:35:51Z",
      "entry_hash": "sha256:9106f85ef8ec41435e94fc5c615d20bb02b7c49836017963045cfc7a399ebb68",
      "event_type": "demo_order_placed",
      "payload": {
        "bitget_order_id": "1453***8417",
        "client_oid": "rl-98eb356e754b0eab27b6442f92c29",
        "risk_policy_decision": {
          "decision": "allow"
        },
        "run_id": "run_1094a295995fc4cdc7dde24b"
      },
      "previous_entry_hash": "sha256:fa1fcc2b3fe64192c755d3d7bd474244aa9397ee6bfb6b43a50eaaae27bcc3bc",
      "release_id": "release-demo-good",
      "schema_version": "redline.release.audit.v1"
    },
    {
      "actor": "service-token",
      "created_at": "2026-06-24T09:35:51Z",
      "entry_hash": "sha256:97114430f23e585d7bad5d8bf1387152c3240a3050a8e298173582fbcef1de1c",
      "event_type": "release_ready",
      "payload": {
        "state": "release_ready"
      },
      "previous_entry_hash": "sha256:9106f85ef8ec41435e94fc5c615d20bb02b7c49836017963045cfc7a399ebb68",
      "release_id": "release-demo-good",
      "schema_version": "redline.release.audit.v1"
    },
    {
      "actor": "service-token",
      "created_at": "2026-06-24T09:35:51Z",
      "entry_hash": "sha256:8ecd679971f245ebac7beaea647a39c09fa14fe9ac9a00ce6141085dcb10b4bd",
      "event_type": "approval_granted",
      "payload": {
        "actor_auth": {
          "actor": "service-token",
          "actor_display_name": null,
          "actor_role": "admin",
          "actor_scopes": [
            "admin",
            "execute-demo",
            "read-only",
            "release-write"
          ],
          "auth_method": "service_token",
          "auth_subject": "service-token",
          "principal_id": "service-token"
        },
        "evidence_manifest_hash": "sha256:1679b028d99273e070021daa1ec454b2bff9c6ac878c146af778dcbfe7720444",
        "identity_lock_hash": "sha256:f11c2d123ce6f90e41532cda93e3e7c46cf7850238b193c1d03676e646a90514",
        "package_hash": "sha256:f0d62f9eba4325984d32f45d1b2ad03227127275aebb53bcb6a7f2dabd120ca6",
        "risk_policy_hash": "sha256:be4e21b5549f1b49b90c90f3f2ceace547192bdd16b2f4ee0feb81a4c78bff96"
      },
      "previous_entry_hash": "sha256:97114430f23e585d7bad5d8bf1387152c3240a3050a8e298173582fbcef1de1c",
      "release_id": "release-demo-good",
      "schema_version": "redline.release.audit.v1"
    },
    {
      "actor": "service-token",
      "created_at": "2026-06-24T09:35:51Z",
      "entry_hash": "sha256:dce15c51a80349d2ef1ebedf87c39d8a11c400d1c055e3343c28440bbb86a0bb",
      "event_type": "showcase_demo_order_requested",
      "payload": {
        "risk_policy_decision": {
          "decision": "allow"
        },
        "run_id": "run_1094a295995fc4cdc7dde24b"
      },
      "previous_entry_hash": "sha256:8ecd679971f245ebac7beaea647a39c09fa14fe9ac9a00ce6141085dcb10b4bd",
      "release_id": "release-demo-good",
      "schema_version": "redline.release.audit.v1"
    },
    {
      "actor": "service-token",
      "created_at": "2026-06-24T09:35:56Z",
      "entry_hash": "sha256:93e7947dde8d47eba9be25da3bcbcf7ff40401df76395030dffba40fe7a06634",
      "event_type": "showcase_demo_order_placed",
      "payload": {